{
  "$schema": "./brand.config.schema.json",
  "appName": "Miu World",
  "shortName": "Miu World",
  "description": "Thế giới 3D vừa chơi vừa học Toán và Tiếng Việt, chơi cùng bạn bè.",
  "colors": {
    "theme": "#8fd0ff",
    "background": "#cdebff"
  },
  "icon": "generated/brand/miu-logo-512.png",
  "iconMaskable": "generated/brand/miu-logo-maskable-512.png",
  "appIds": {
    "ios": "com.hoandat.miu",
    "android": "com.hoandat.miu"
  },
  "urlScheme": "com.hoandat.miu",
  "primaryTenant": {
    "domain": "hoandat.com",
    "issuer": "https://auth.hoandat.com"
  },
  "hostTemplates": {
    "web": "miu.{domain}"
  }
}
